{
  "contract_name": "BIFROST_SPECIALIST_RESULT_v0.1",
  "contract_version": "BIFROST-SPECIALIST-RESULT-v0.1.3",
  "specialist_type": "supply",
  "status": "completed",
  "request_id": "FIX-01",
  "source_release_id": "REL-TEST",
  "source_snapshot_id": "SNAP-TEST",
  "conclusion": "未检测到供应连续性风险信号",
  "severity": "unknown",
  "confidence": 1.0,
  "metrics": [
    {
      "metric_id": "M-SUP-001",
      "label": "PO-TEST-0001#row1 采购数量",
      "value": 1000.0,
      "display_format": "#,##0",
      "semantic_field": "purchase_qty",
      "evidence_refs": [
        "EVREF-v1:553e0295c0a085d3151d6cdbe5d279d3ec371745b51a35d16d7261133bd9ea3b"
      ]
    },
    {
      "metric_id": "M-SUP-002",
      "label": "PO-TEST-0001#row1 到货数量",
      "value": 1000.0,
      "display_format": "#,##0",
      "semantic_field": "arrived_qty",
      "evidence_refs": [
        "EVREF-v1:389d4a1da99ca49798af2868b17b35d4debd29cee1904bbd4a9659b8c5fd419d"
      ]
    }
  ],
  "causes": [],
  "affected_objects": [
    {
      "object_type": "purchase_order",
      "object_id": "PO-TEST-0001#row1"
    }
  ],
  "recommended_actions": [],
  "needs_human_confirmation": false,
  "evidence_refs": [
    "EVREF-v1:b81c7e9e48e3818b4149d0e4c7f9669be26d215228cc89474f2e82cdb0150f99",
    "EVREF-v1:553e0295c0a085d3151d6cdbe5d279d3ec371745b51a35d16d7261133bd9ea3b",
    "EVREF-v1:389d4a1da99ca49798af2868b17b35d4debd29cee1904bbd4a9659b8c5fd419d",
    "EVREF-v1:8cc0db0e01432eec066fa2e42a2498d30e7d4848dd1c0a87ff01d67678fbef10",
    "EVREF-v1:8e0d77e29cf72ec779803314fa771cfdf69d3d92a918b5bd998e3bcc82faa7c2"
  ],
  "data_gaps": [],
  "actor_can_execute": false,
  "contract_versions": {
    "specialist_result_contract_version": "BIFROST-SPECIALIST-RESULT-v0.1.3",
    "decision_input_contract_version": "BIFROST-DECISION-INPUT-v0.1",
    "specialist_logical_version": "SUPPLY-LOGIC-v0.1.3",
    "delivery_status_rule_version": "SUPPLY-DELIVERY-STATUS-v0.2",
    "arrival_compare_rule_version": "SUPPLY-ARRIVAL-CMP-v0.2"
  },
  "validation": {
    "status": "passed",
    "issues": [],
    "warnings": [],
    "input_contract_valid": true,
    "evidence_contract_valid": true,
    "output_contract_valid": true
  },
  "local_trace_id": "SUPPLY-7a6587a804704ecf",
  "specialist_details": {
    "confidence_basis": {
      "method": "evidence_coverage",
      "usable_facts_with_evidence": 5,
      "total_usable_facts": 5
    },
    "stage": "04D.4B_SUPPLY_P1_DELIVERY_SEMANTIC_FIX_LOCALLY_VALIDATED_NOT_DEPLOYED",
    "generated_at": "2026-08-11T10:16:07Z",
    "shortage_as_continuity_risk": true,
    "inventory_grain_status": "unresolved",
    "relation_materialized": false,
    "evidence_ref_granularity": "field_level_EVREF-v1",
    "delivery_semantic_fix": "v0.1.3_P1_actual_arrival_date_is_registered_only",
    "expedite_gate": "explicit_request_required",
    "action_identifier_scope": "local_run_only"
  }
}